sentence_id,text_source,text,ppl_grok-3_model,nll_grok-3_model,ppl_gpt-5_model,nll_gpt-5_model,ppl_gpt-5-mini_model,nll_gpt-5-mini_model,ppl_human_model,nll_human_model,ppl_pooled_ai_model,nll_pooled_ai_model,ppl_llama-3.3-70b-instruct_model,nll_llama-3.3-70b-instruct_model
6d022151fb79dbc4464720d851867794,gpt-5,"7. Funds from the United Nations, the International Astronautical Federation and other co‑sponsoring organizations of the workshop are used to cover the international air travel of selected participants from developing countries and their daily subsistence allowance during the workshop and the International Astronautical Congress.",33.78790768750677,3.5201029777526855,33.819218444457626,3.521029233932495,33.68618916848072,3.517087936401367,35.69950774189604,3.57513689994812,26.66498237137586,3.283351182937622,33.65247411561848,3.5160865783691406
b6208ab60e1c83000ef24b311d68b82f,gpt-5,"Speakers, chairpersons and participants from Austria, Canada, France, Germany, Italy, Malta, the Netherlands, Norway, the United Kingdom of Great Britain and Northern Ireland, and the United States of America also participated in the workshop.",6.677978181120596,1.8988152742385864,6.673162060422317,1.898093819618225,6.7955176294603,1.916263222694397,6.631757044900549,1.8918697834014893,5.971079310202074,1.7869277000427246,6.628083507091365,1.8913156986236572
65de4111b88b7d922f16e73b4717b63a,gpt-5,"12. Space technology has become an increasingly important part of daily life, but it is marked by rising costs and growing complexity, which means that most developing countries should exercise great care in deciding the scale and pace at which to develop their own space activities.",20.234992087524777,3.007413387298584,19.341242678512533,2.9622397422790527,19.433415778969756,2.966994047164917,20.3960116532442,3.0153393745422363,16.873199066770415,2.8257265090942383,19.60284344054309,2.975674629211426
aea216202072edcebdb5d32c90243029,gpt-5,"28. Although the European Space Agency’s European Remote Sensing Satellite system was not designed specifically to meet the needs of developing countries, its data play an important role, particularly in areas such as environmental monitoring, food production and climate change.",19.561510969069417,2.9735639095306396,16.646473638264858,2.8121984004974365,18.131603052368387,2.8976564407348633,20.47003572383479,3.0189621448516846,11.905780974927978,2.4770240783691406,19.73227652379553,2.982255697250366
a14cfad03bdc1dcbae124757f567deb2,gpt-5,"Remote sensing satellites are particularly useful in formulating disaster risk reduction measures and in monitoring, and can contribute to risk analysis by enhancing understanding of the processes by which natural disasters evolve.",37.56848854599891,3.6261656284332275,37.613416959322485,3.6273608207702637,37.529679898458475,3.6251320838928223,38.29430166756905,3.645301103591919,31.9080763144126,3.4628591537475586,37.44141564799756,3.6227774620056152
eb3bdfcf3805a39551e363ddc46d3fa0,gpt-5,"By integrating data on fuel types with other parameters, firefighting authorities can prevent and control fires more effectively, thereby substantially reducing annual losses and achieving significant savings in fire suppression expenditures.",52.605893612513746,3.9628281593322754,53.11544014840451,3.9724676609039307,52.81800773274208,3.9668521881103516,53.902810380055314,3.9871826171875,46.202616132519196,3.833036422729492,53.677342233985726,3.9829909801483154
1f0fc53f16b4d279603a05a8d986cfef,gpt-5,"54. A United Nations/International Astronautical Federation workshop should be held in the future, with emphasis on ways to overcome managerial, legal, political, financial and educational obstacles, so as to enable developing countries to make better use of space technology.",22.800150994592233,3.126767158508301,22.732221105145598,3.1237833499908447,23.08423470550968,3.1391499042510986,23.59723898575608,3.1611297130584717,19.25611668528827,2.9578287601470947,22.411582345239918,3.1095778942108154
1af64f124b14270b58d42def3d4724d5,gpt-5,"58. Although some telehealth applications require real-time capabilities (for example, videoconferencing for remote surgery and remote psychiatric treatment), other applications, such as the transmission of images and files, consultations or research, can be supported on a store-and-forward basis.",28.688239755429223,3.356487274169922,28.255660573350397,3.3412938117980957,28.37977264321996,3.3456766605377197,28.558836020982064,3.351966381072998,27.292827417181865,3.306623935699463,28.229076695992628,3.3403525352478027
aadca9e110fbe675797d8e89da87b9e3,gpt-5,"However, to develop health care and educational support services, it is necessary to study and resolve not only technical issues but also managerial, legal and political ones; these issues should not be allowed to impede the development of appropriate satellite services on a global scale that are already feasible.",28.650078503458264,3.355156183242798,28.20130081113663,3.3393681049346924,28.55461477957564,3.351818561553955,28.7181247579449,3.3575284481048584,26.186119062034646,3.2652294635772705,28.739776075533957,3.3582820892333984
ce0a304a818543805471e63cbc0bc539,gpt-5,"66. With regard to the Tropical Ecosystem Environment Observations by Satellite project, jointly sponsored by the Commission of the European Communities and the European Space Agency, a deforestation monitoring system should be developed, combining low- and high-resolution data and using the Tropical Forest Information System.",35.72988091155311,3.5759873390197754,34.98375176770994,3.5548837184906006,35.389386968706525,3.5664119720458984,36.53647898842254,3.598311185836792,32.10594923873452,3.469041347503662,35.39486332167794,3.5665667057037354
fc24f5995620d3bb7ffd8c05ff58d860,gpt-5,"68. Voice, facsimile and data terminals should continue to be sited at strategic locations, so that even if disasters render radio or television infrastructure inoperative, there remains an undisturbed source of warning.",58.055915843268,4.06140661239624,55.79837393921502,4.021744728088379,56.384114546428975,4.032187461853027,57.140336855611956,4.045510292053223,53.24234255484715,3.974853992462158,57.109828770728235,4.044976234436035
ac515c6a876f33806a6132fcc5c3ff25,gpt-5,"4. In September 1994, the application form and an information note on the training course were sent by the United Nations to the offices of the United Nations Development Programme (UNDP), which then forwarded them to the national authorities of the following 13 countries in the region: Angola, Benin, Burkina Faso, Cameroon, the Central African Republic, Chad, Congo, Côte d’Ivoire, Gabon, Mali, Niger, Togo and Zaire.",13.379086509556394,2.5936927795410156,13.038812155454146,2.5679304599761963,13.29080406548672,2.5870723724365234,13.367375418945736,2.5928170680999756,12.455843317507828,2.5221898555755615,13.238158018361986,2.5831034183502197
c52a73469fbfd61b34837d23ac19807c,gpt-5,"Other participants came from the United Nations Office for Outer Space Affairs, the European Space Agency, the German Aerospace Center, Scot Conseil, and the Space Remote Sensing Technology Development Group.",18.09155235152937,2.8954451084136963,18.721087178173377,2.9296505451202393,18.49465736437952,2.9174818992614746,18.481380808580177,2.9167637825012207,15.841794702601671,2.7626516819000244,18.06122036383024,2.8937671184539795
2ac2ce30ab3dff599c29f32ccc1faed9,gpt-5,6. The costs of attendance at the training course for 13 international participants from developing countries were met from appropriations under the United Nations budget; they also received financial support from the European Space Agency.,45.16559552870971,3.810335636138916,45.6421565715924,3.820831775665283,45.20631811467999,3.81123685836792,46.95133111487225,3.849111557006836,40.01239157975423,3.6891891956329346,44.84508850668097,3.8032140731811523
dda454d7dd187bf93ecaed3c178bc6d5,gpt-5,"On the final day of the training course, the regional projects designed by the participants in the working groups were formally presented and discussed; as a source of information for these projects, the acquisition and use of Earth resources satellite data will be a key factor.",38.03952916422303,3.6386258602142334,37.80359966758,3.632404327392578,38.77915767007739,3.6578829288482666,37.87731733053644,3.634352445602417,33.76021560998853,3.5192830562591553,38.14795305871964,3.641472101211548
b40d8fd1f00ad2afb56266beadee7687,gpt-5,"This characteristic makes radar imagery particularly useful for distinguishing between dry and wet soils and for identifying vegetated areas, since high moisture content produces a strong radar response.",54.11814097554432,3.9911694526672363,55.393538193588,4.014462947845459,54.40483599070194,3.996453046798706,55.72217110976675,4.020378112792969,50.60319956212706,3.9240148067474365,54.05498009273974,3.990001678466797
2d601f9f0f9c99629d887d3b5f8f8839,gpt-5,"19. In general, by understanding the interdependencies among the principal factors that influence radar response (such as incidence angle, moisture, surface roughness, geometry and slope aspect), one can interpret Earth resources satellite imagery acquired on a single date for a variety of terrestrial applications.",64.7158273506754,4.170005798339844,64.1253369236881,4.160839557647705,64.44182644863447,4.165762901306152,64.88159735789593,4.1725640296936035,61.73540372528471,4.122857570648193,65.10107033309797,4.175940990447998
c43b66cdff5b3b4c5342a9baba572569,gpt-5,"These applications may fall into one or more of the following categories: (a) feature identification; (b) delineation of the spatial extent of a feature of interest; (c) change detection, such as forest degradation; and (d) quantitative determination of biogeophysical parameters, such as soil moisture content.",13.737945817195836,2.620161771774292,13.467688847065304,2.6002933979034424,13.49902556153938,2.6026175022125244,13.522569490192925,2.6043601036071777,12.976866694739346,2.5631682872772217,13.835038806447523,2.627204418182373
f275d2072c87244bfa63503937cf23e2,gpt-5,"Techniques for combining optical and radar data, such as producing color composites and intensity–hue–saturation transformations, can be used to emphasize or de-emphasize surface features while preserving the information derived from both datasets.",46.79975116014196,3.8458778858184814,47.05219712660828,3.851257562637329,46.25867526299897,3.8342490196228027,49.12051937489365,3.8942768573760986,41.439916980129794,3.7242445945739746,46.809426085514914,3.8460845947265625
0226961a5dc2a220f1b270ad3eac827a,gpt-5,"25. Because digital processing of Earth resources satellite imagery (such as geocoding and enhancement) involves large data volumes, it is necessary to have access to high-performance personal computer systems equipped with software capable of processing and displaying 16-bit Earth resources satellite imagery.",35.80985835182869,3.57822322845459,35.97789836709063,3.582904815673828,36.39178080212846,3.5943429470062256,37.45902329671331,3.6232476234436035,31.415214942980512,3.4472923278808594,36.11154792900993,3.5866127014160156
05fdd6fe1dcf416566c0313c1850b4e5,gpt-5,"In this regard, private companies in Europe have experience in the digital processing and enhancement of Earth resources satellite data and in photographic reproduction, and their services can be used to produce large-scale photomaps.",53.585469647389274,3.9812779426574707,51.38141117884503,3.9392764568328857,52.58125391768996,3.962359666824341,53.62309472184083,3.9819798469543457,46.13841801712325,3.831645965576172,52.918000902818896,3.9687435626983643
97ef6bfb616f3d0987bd0efcf3da2814,gpt-5,"In this regard, participants will be requested to submit more detailed project proposals than those prepared during the training course, in order to properly assess the relative merits of the various proposals and to facilitate the selection, on a competitive basis, of a number of projects worthy of support.",23.596862045414007,3.161113739013672,23.618790852966544,3.1620426177978516,24.049369635575182,3.1801087856292725,24.081695664056298,3.1814520359039307,21.354736705912412,3.0612735748291016,23.33038690710771,3.149756669998169
568e6a50c68402b5e2a93b71c2ce6cec,gpt-5,"(b) Subsequently, arrangements to support the selected projects will be made within the framework of the assistance programme currently being developed jointly by the Office for Outer Space Affairs and the European Space Agency.",18.993776012253225,2.9441113471984863,18.518678104173564,2.9187798500061035,18.733723018211972,2.9303252696990967,19.51513761915494,2.9711904525756836,15.410362732610613,2.7350401878356934,19.05227864728665,2.9471867084503174
e9c0cf3eec14db2828727425cb200010,gpt-5,"The MSS is an advanced robotic system that will play a leading role in the assembly, maintenance and operation of the space station. Canada is participating in this effort together with Japan, the Russian Federation, the United States and the participating Member States of the European Space Agency.",13.350408883157453,2.5915470123291016,12.949918771904075,2.561089515686035,13.26007401347311,2.5847575664520264,13.367780177966607,2.5928473472595215,12.824742883342832,2.5513763427734375,13.275767236125986,2.585940361022949
755e201e8de60869ac0692b0f36038af,gpt-5,"21. The Government also announced in June 1994 that, following the successful conclusion of discussions with the National Aeronautics and Space Administration of the United States, Canada would continue to participate fully in the International Space Station programme, notwithstanding a reduction in funding.",12.471797870070182,2.523469924926758,12.08158089351177,2.4916820526123047,12.28906286835849,2.508709669113159,12.573964545446033,2.531628370285034,10.97282741585002,2.3954219818115234,12.183896930872972,2.500115156173706
1a933dacf504df1807d7e834b79e897b,gpt-5,"The new Canadian space plan also underscores the strategic importance of space activities to Canada’s transition to a knowledge-based economy, and designates the Canadian Space Agency as the lead coordinating body for all Government of Canada policies and programmes in civilian space research, science and technology, industrial development and international cooperation.",33.51818275458933,3.5120880603790283,27.058399500499103,3.29799747467041,29.63141724097722,3.3888351917266846,32.35324654000125,3.4767143726348877,24.253373411671145,3.1885557174682617,33.05309808147726,3.498115301132202
96bf4e6f061e5a61796c3de94167a29c,gpt-5,"30. New demonstration and experimental activities are currently under way with a view to expanding and strengthening INSAT services for various purposes, in particular new types of telecommunications services and distance education.",60.46767685363355,4.102108955383301,57.70196196769449,4.055291175842285,59.914776711183,4.092923164367676,60.15134161393784,4.096863746643066,51.384241072155575,3.939331531524658,58.99978040347708,4.077533721923828
f9dd21a947a0d9e6e6ab84d598edc010,gpt-5,"Apart from the Wide-Field Sensor and the X-ray astronomy payload, IRS-P3 also carries the German Aerospace Center’s Modular Optoelectronic Scanner for ocean remote sensing. The satellite is scheduled to be launched by the PSLV-D3 launch vehicle in the first quarter of 1996.",39.839724639230525,3.6848645210266113,33.89271298533536,3.523200035095215,36.740885474091264,3.6038901805877686,39.72545054613781,3.6819920539855957,30.228360550855516,3.408780574798584,40.05280305270503,3.6901986598968506
3e7e0a1d223a24c36a5a45f06fb8ecf1,gpt-5,34. Implementation of the local action plans formulated under the Integrated Mission for Sustainable Development (IMSD) is proceeding smoothly in 21 districts in India. The mission primarily uses Indian Remote Sensing (IRS) data and related socio-economic data.,35.29238779074732,3.5636672973632812,36.27926502013708,3.5912463665008545,36.529005735926425,3.598106622695923,36.49435088486136,3.5971574783325195,33.276813993128485,3.5048608779907227,36.255641868523185,3.590595006942749
0739710eb89ee27dbd5b36cc6d0da2be,gpt-5,"35. India has established the INSAT and IRS satellite systems, providing uninterrupted services in telecommunications, television broadcasting, meteorology, disaster warning, and the survey and management of national resources. 15 October 1994 marked an important milestone in the development of India’s capability to launch such satellites, as it successfully conducted the second developmental launch of the Polar Satellite Launch Vehicle (PSLV-D2).",35.616099731187404,3.5727977752685547,30.52619178123676,3.4185850620269775,33.07485534381065,3.4987733364105225,36.33870215813485,3.592883348464966,24.46118379633124,3.197087526321411,36.13276837348056,3.587200164794922
e50f03ecf7e19585947566d1e21eb426,gpt-5,"These rockets will be used to demonstrate the PSLV’s reliability, increase the PSLV’s operational payload capacity, launch Earth observation satellites, and carry out scientific flight missions.",44.555220333195,3.796729326248169,33.90903983456337,3.523681640625,37.70295861626098,3.6297385692596436,43.85814988629241,3.7809605598449707,26.82595319051012,3.289369821548462,45.43794727694698,3.816347599029541
c869debf61d0a28a3d8583968e178e11,gpt-5,44. The Committee on Space Activities was established in 1968 under the Prime Minister’s Office pursuant to the Act on the Establishment of the Committee on Space Activities to continue and develop the work of the National Council for Space Activities established in 1960. Its purpose is to coordinate the space activities of the various government agencies and to actively promote them.,17.867862563634983,2.8830037117004395,16.46099170020873,2.8009934425354004,17.41540842830858,2.8573553562164307,18.852041098459516,2.9366211891174316,13.777043895999057,2.6230037212371826,18.17467140980121,2.900028944015503
46ba06240a803dcf75e5f1c6ce5f72c0,gpt-5,"46. The Space Activities Commission is composed of five eminent scholars nominated by the Prime Minister with the approval of Parliament, including the Minister of State for Science and Technology, who serves as Chair of the Commission.",14.492319123943387,2.673618793487549,14.493525052222745,2.6737020015716553,14.90848513361898,2.701930522918701,15.26615657212193,2.7256383895874023,13.163990172453667,2.5774850845336914,14.414626326423798,2.668243408203125
a4677d152e03948123601446879ad9d0,gpt-5,"71. The Kagoshima Space Center is located in a hilly area of Uchinoura Town on the east coast of the Osumi Peninsula in Kagoshima Prefecture. Covering 71 hectares, the Center houses various rocket launch, telemetry and tracking facilities, command stations for rockets and satellites, and an optical observatory, all sited on several leveled hilltops.",34.93106109921491,3.5533764362335205,35.846016829361176,3.5792324542999268,35.51407592859274,3.5699291229248047,36.13064059947906,3.587141275405884,32.91225187818862,3.493844985961914,35.329186133414616,3.564709424972534
2fd1d6dad1d78db5b60e3c596a2798e8,gpt-5,85. Satellite data can be used to improve operational weather forecasting and are used in the World Meteorological Organization’s International Satellite Cloud Climatology Project (ISCCP) and Global Precipitation Climatology Project (GPCP).,16.098584455885636,2.778731346130371,13.672450690709733,2.6153829097747803,14.954985857317638,2.705044746398926,16.76796809790396,2.8194704055786133,11.414816502617967,2.4349122047424316,16.23840742288492,2.787379264831543
f7ee2bd8860ca3116369b5866016c0d3,gpt-5,"The main activities of the Ministry of Posts include researching and formulating concepts for long-distance space communications and complex satellite systems, as well as pilot programmes to promote the utilization of satellites and advanced satellite communications systems.",31.59343309373341,3.452949285507202,31.847585806028604,3.4609615802764893,31.991601443679723,3.4654734134674072,32.18036971045532,3.4713566303253174,31.333986543901734,3.4447033405303955,31.296745317025493,3.443514108657837
850171495121095f2fc8d420db281f2b,gpt-5,89. The Communications Research Laboratory conducts research and development on a variety of space technologies to meet the diverse communications needs of the era of advanced information technology and human spaceflight.,22.214171013227023,3.1007304191589355,22.064612198172597,3.093975067138672,22.29584097989477,3.104400157928467,23.692759081286454,3.1651694774627686,20.746117551740298,3.0323591232299805,22.210527477554223,3.1005663871765137
0052f2635990152a33cd93f82ba02e10,gpt-5,"98. The N-STAR communications satellite (N-STAR a), purchased by Nippon Telegraph and Telephone Corporation from the United States, was launched by an Ariane rocket in August 1995 to maintain the satellite communications services currently provided by the CS-3 satellite.

(d) Broadcasting",32.54259692532835,3.4825499057769775,31.951415093477078,3.464216470718384,32.740946466823914,3.488626480102539,32.24869579648593,3.473477602005005,30.119874089447645,3.4051852226257324,32.299927734517325,3.475064992904663
ebed5f569c0e747aafb7129b72d7a2f7,gpt-5,"103. A multibeam-antenna satellite broadcasting system operating in the 21 GHz band will be developed for future satellite broadcasting services, including high-definition television, integrated services digital broadcasting and provincial/regional satellite broadcasting.",38.03960171893617,3.638627767562866,37.56331174187388,3.626027822494507,37.87693804487597,3.6343424320220947,39.718470821981235,3.681816339492798,34.21287625045516,3.532602071762085,37.70800183067124,3.6298723220825195
99f9169849fa905561c6d7d5c719a711,gpt-5,"115. The purpose of the Engineering Test Satellite (ETS) programme is to develop various advanced technologies required for the practical applications of satellites (Earth observation, broadcasting, communications, etc.), thereby promoting Japan’s technological development.",36.155932171385295,3.587841033935547,30.133995515252018,3.405653953552246,32.945405992159834,3.49485182762146,37.95796555054395,3.636479377746582,23.919038920691722,3.1746747493743896,36.968049631248554,3.6100540161132812
20473e74710bfec10778e4ae6c7690ee,gpt-5,"The purpose of ETS-VI is to verify the capability of the H-II launch vehicle, to establish the technology for a two-ton-class, three-axis-stabilized satellite bus, and to test advanced satellite communications equipment.",35.35766780205048,3.5655152797698975,35.91902568393191,3.5812671184539795,35.52979455812839,3.570371627807617,37.027114438350985,3.6116504669189453,34.4318796140684,3.53898286819458,34.506565705724356,3.541149616241455
5f3756290ee2a5bad910aa3966fc89e6,gpt-5,"123. Consideration is currently being given to undertaking, in the near term, a range of activities in various space science programmes and research fields using the M-V launch vehicle, including: X-ray astronomy; a cometary coma sample-return mission; lunar/Martian rover missions; Venus aerial imaging/balloon missions; an asteroid sample-return mission; infrared astronomy; solar physics; and atmospheric science.",36.631141624159454,3.6008987426757812,36.06921321696742,3.585439682006836,36.1412462556356,3.587434768676758,37.137787813153246,3.6146349906921387,35.61538644897909,3.57277774810791,36.15216532012997,3.5877368450164795
d1b7ee3164c34c312fdeac6543d0547f,gpt-5,"133. As a first step, following glide tests with a small-scale model aircraft conducted in June 1986, several test flights were carried out in 1987, yielding useful data for further research in the two aforementioned fields.",37.46797315467392,3.6234865188598633,37.91945069675257,3.6354641914367676,38.77196520460237,3.6576974391937256,39.082206842742906,3.6656672954559326,34.691269179916866,3.546488046646118,37.23244601601636,3.617180585861206
2f6308e9a071a87590ba7331781c1243,gpt-5,"140. On the basis of an exchange of letters between the United States National Aeronautics and Space Administration and the Space Applications Center in July 1979, meetings of the Senior Standing Liaison Group were held alternately at the two institutions, with a view to promoting cooperative projects between Japan and the United States in the fields of Earth observation, space science, life sciences and microgravity science, and to exploring new cooperative projects.",19.299762361786698,2.960092782974243,19.10839639029258,2.9501278400421143,19.404312748308804,2.9654953479766846,19.463768957900623,2.968554735183716,17.92039338627475,2.885939359664917,18.954030525716355,2.9420166015625
0cbf3cbe7a564b0345dec7227bdeb444,gpt-5,"At the private-sector level, Japanese companies plan to participate in Germany’s D-2 programme, a programme of microgravity experiments using a space laboratory. (c) Cooperation with the Russian Federation",65.72517446925127,4.185482025146484,48.383367727526824,3.8791561126708984,56.206409580170366,4.029030799865723,59.0614808097945,4.078578948974609,41.449817968949866,3.7244834899902344,65.5974620131825,4.183537006378174
e5768bb348cf27e9b3a21f69ebd09f2c,gpt-5,"The proposed college affiliated with the university will offer a five-year programme of study, comprising three years of general education and two years of specialized education in cartography, photogrammetry, geoinformation systems and remote sensing.",19.94251014488918,2.9928536415100098,19.723095395699335,2.98179030418396,19.951284431374656,2.993293523788452,20.463404284568018,3.0186381340026855,19.183779119999823,2.9540650844573975,19.699550674891018,2.980595827102661
b6276f113b42f3c8e980a8bb1e8a8993,gpt-5,Satellite imagery and aerial photography are being used to investigate the deterioration in land use from 1945 to 1994 caused by human activities and urban development in the Greater Amman area.,41.88518499026863,3.7349321842193604,42.99976738222081,3.7611947059631348,42.67361479023337,3.7535808086395264,43.04353468404865,3.762212038040161,38.90153190230913,3.6610336303710938,42.61859778404707,3.752290725708008
