sentence_id,text_source,text,ppl_grok-3_model,nll_grok-3_model,ppl_gpt-5_model,nll_gpt-5_model,ppl_gpt-5-mini_model,nll_gpt-5-mini_model,ppl_human_model,nll_human_model,ppl_pooled_ai_model,nll_pooled_ai_model,ppl_llama-3.3-70b-instruct_model,nll_llama-3.3-70b-instruct_model
b9e6784e38a1d1391bd5c3b452c52772,grok-3,"Once such a database is established, it can be interactively evaluated by health and education organizations worldwide to determine how these systems can be used for low-cost distance education, telemedicine, and remote healthcare services.",28.150864321216165,3.337578058242798,29.43541591002759,3.3821985721588135,29.855233733361317,3.396360158920288,29.544036139338733,3.3858819007873535,27.131920596563617,3.300710916519165,28.13806803938222,3.337123394012451
38549ee8b01dc14851527fc1adf60667,grok-3,"The University of the West Indies Distance Teaching Experiment, the Indonesian Distance Education Satellite System, and the Peru Rural Telecommunications Services Project currently encompass 25 conference sites, benefiting thousands of university students, teachers, doctors, nurses, health workers, and researchers.",59.68588692281165,4.089095592498779,60.274285099779064,4.098905563354492,60.32362487151813,4.099723815917969,62.688431060948794,4.138176918029785,58.31344095506762,4.065832614898682,59.395530467448914,4.084218978881836
02fe7cde832e1d347f901cf0183326ac,grok-3,"1. The fifth United Nations training course on remote sensing education for educators was held from May 2 to June 9, 1995, in Stockholm and Kiruna, Sweden. The course was organized by the United Nations Programme on Space Applications in cooperation with the Government of Sweden.",20.830409370427674,3.0364139080047607,21.036131814265694,3.046241521835327,21.448562260855073,3.065657615661621,21.65279435776229,3.075134515762329,18.394723129642824,2.9120638370513916,20.864635789934397,3.038055658340454
b4c40b0bf317aecdae717b56ae25a309,grok-3,"10. Data from various satellites (such as the European Remote Sensing Satellite, Landsat, the French Earth Observation Satellite, the ResourceSat series, the Japanese Earth Resources Satellite, the Indian Remote Sensing Satellite, and meteorological satellites) can be used to analyze issues related to national development, particularly those concerning the assessment of natural resources and environmental monitoring.",16.554702309087197,2.8066701889038086,16.750794375100043,2.8184456825256348,16.893458395447468,2.8269264698028564,17.74163005326709,2.8759138584136963,14.083095612323604,2.644975185394287,16.755291885640887,2.818714141845703
f203db3e5edaca48f4147b4e34c477cf,grok-3,"In general, multispectral and radar instruments utilize different regions of the electromagnetic spectrum and can often provide complementary information, which can be used to address numerous issues related to national development.",27.947599922794314,3.330331325531006,28.88482977300707,3.363316535949707,28.997764268759624,3.3672187328338623,29.69244819845246,3.390892744064331,26.374773618523175,3.2724080085754395,28.25858444132879,3.341397285461426
528ee6338b8505f306e1807c359163ab,grok-3,"However, if data is available in digital form, users gain greater flexibility to perform local or global image enhancement or classification suitable for a range of application areas, as needed for their convenience.",62.211857470454895,4.130545616149902,63.01426262322096,4.1433610916137695,62.699731320837444,4.138357162475586,60.176443945775816,4.097280979156494,64.2612135040617,4.162956237792969,61.8535324766457,4.12476921081543
c8435f329ae64afd0d42d83f56c60f47,grok-3,"During the spatial analysis process conducted in response to a query, the four types of data mentioned above can be used for various operations (such as overlay, proximity analysis, interpolation, classification, and time series analysis).",29.988330850725678,3.400808334350586,31.925593535899978,3.4634079933166504,31.46450762311199,3.4488601684570312,30.85369997832947,3.4292566776275635,29.76632678387601,3.3933777809143066,30.640064347266875,3.4223084449768066
8882b856f764628def750febe3a285cb,grok-3,"The Institute of Space and Earth Sciences, in collaboration with Western University, is studying the potential of using large-diameter, non-adjustable ground-based telescopes based on the liquid mirror concept proposed by Laval University to monitor space debris.",31.468618835991474,3.448990821838379,31.72036078486568,3.456958770751953,32.46898760111572,3.480285406112671,32.889150891327056,3.49314284324646,29.239888429642836,3.3755338191986084,30.950274503942197,3.4323818683624268
7c6ddb209ce1964526763ff06e9dbc28,grok-3,"Based on collision data recorded at long-term exposure facilities, the University of Toronto Institute for Aerospace Studies is developing a design puzzle to predict the number of collisions a spacecraft may experience due to factors such as altitude, inclination, time in orbit, and orientation.",28.519935730542727,3.3506033420562744,29.028546140686455,3.3682796955108643,28.878983573332036,3.36311411857605,29.475817878369625,3.3835701942443848,29.257621903923823,3.3761401176452637,28.645939391607524,3.3550117015838623
08ede6e17c33b23b841be655528c332a,grok-3,"The Japan Space Development Agency, responsible for the practical application of space development in Japan, established its own working group in August 1993 to study the issue of space debris and to formulate the agency's policies, as well as standards for debris reduction and protection.",25.50678589997875,3.2389445304870605,25.29618927424045,3.230653762817383,25.611885874828335,3.243056535720825,25.34026054646966,3.2323944568634033,21.999067808257323,3.0910000801086426,24.9941311350081,3.2186410427093506
c0bc2439b54489cfd510e9f6ea7ec553,grok-3,"Figure 1 shows an example of observed debris, where 8 antenna beams are used, transitioning sequentially from one pulse to another around the zenith.",89.24904849031098,4.491430759429932,91.01909300860791,4.511069297790527,89.74776086346651,4.497003078460693,89.61130564448307,4.495481491088867,87.88439375685067,4.476022243499756,88.95342574139433,4.488112926483154
433bf5d5849b6e305f20e5e57d985f1c,grok-3,The financial report for the fiscal year 1994 was published in March 1995.,23.983721193847522,3.177375316619873,23.45153790889146,3.1549360752105713,23.63917881025345,3.16290545463562,23.548219822678234,3.159050226211548,19.255037826756798,2.957772731781006,24.088442899407134,3.181732177734375
e3f4c75f861df5c4aed6d54911a455c9,grok-3,"To study ultra-high-speed collision phenomena with speeds reaching up to 15 kilometers per second, the Japan Aerospace Exploration Agency has been collaborating with Mitsubishi Heavy Industries, Ltd. to develop a shaped charge launch system capable of accelerating aluminum projectiles weighing in grams to speeds exceeding 10 kilometers per second.",25.969529642917887,3.2569239139556885,26.74493220290667,3.2863450050354004,26.66616487905615,3.283395528793335,27.464423694556817,3.3128914833068848,25.46979592510937,3.2374932765960693,26.52760381970682,3.2781858444213867
db74e318bc9b2605f5d583a1d855516f,grok-3,"These international coordination meetings also provided an opportunity for the European Space Agency (ESA), which represents its member states in the Inter-Agency Space Debris Coordination Committee (IADC), to disseminate information exchanged during IADC meetings. The 1995 annual meeting of the IADC was held in March 1995 in Houston, Texas.",13.458508668195362,2.599611520767212,13.759403204423826,2.621722459793091,13.81602925392322,2.6258294582366943,13.789044856082358,2.6238744258880615,12.70125541299935,2.541700839996338,13.483727438237317,2.6014835834503174
70987c81e624a5363b060fc9b85eb110,grok-3,The European Retrievable Carrier Solar Array 3 covers a maximum illuminated area of 99 square meters on the retrievable satellite.,213.58220167157936,5.3640217781066895,205.8461174916537,5.327128887176514,209.3700658755713,5.3441033363342285,205.84749166732817,5.3271355628967285,190.8503549986952,5.251489639282227,212.5591929769322,5.359220504760742
c0484f1f789a1390e54f4d08304f1c04,grok-3,"The Timeband Capture Cage Experiment (TICCE) 8, conducted on the European Retrievable Carrier platform, provided the capability to capture intact microparticles in substances such as aerosols.",107.35010320231031,4.676095485687256,107.59716691845918,4.678394317626953,108.61302626558518,4.687791347503662,105.09701348497747,4.654883861541748,105.02883023853884,4.654234886169434,109.68679375236194,4.697628974914551
f5f08008d2f370357f532794e6a09b85,grok-3,"Several studies have explored the threat posed by the fragmentation of launch devices to payloads, the threat of fragmentation of a satellite component to a satellite constellation, and a comparison of modeling techniques between Europe and the United States of America.",33.54273320010979,3.512820243835449,33.431445104138426,3.5094969272613525,33.519069807010176,3.5121145248413086,32.67942241683002,3.486745595932007,32.74549771023567,3.4887654781341553,33.7158943933279,3.5179693698883057
356097fd94fc135e0cb7678be77f9452,grok-3,2. The Committee on the Peaceful Uses of Outer Space endorsed this proposal at its thirty-eighth session.,14.808514962266534,2.695202350616455,14.841067746593323,2.6973981857299805,14.546355883516256,2.677340507507324,15.896322139082322,2.766087770462036,12.740941482054577,2.544820547103882,14.933112978528056,2.7035810947418213
4b7f802da3a71b374620646ead1d9b55,grok-3,"15. A major U.S. company responsible for developing a constellation of 66 small communication satellites, known as Iridium, has incorporated debris mitigation measures into the initial stages of its program.",36.96373108727668,3.6099371910095215,37.775282166691944,3.631654977798462,38.15438389350146,3.6416406631469727,38.98807889120365,3.6632559299468994,35.88390574458586,3.580288887023926,37.19049964662667,3.616053342819214
6e502c66e635adb80d2af7ece4e310cd,grok-3,"In the manned space program of the Russian Federation, as in the manned space program of the former Union of Soviet Socialist Republics, debris is cleared to oceanic areas through the Progress supply spacecraft and aging orbital stations (with the exception of Kosmos 557, Salyut 2, and Salyut 7/Kosmos 1686 stations).",36.48680795706087,3.5969507694244385,36.71003797375592,3.6030502319335938,36.53380481684148,3.598237991333008,36.28173025437442,3.5913143157958984,38.183513589153186,3.6424038410186768,36.495264494081674,3.597182512283325
4c20820a390d6750115310c31da6e79e,grok-3,"The Subcommittee recommends to the Committee on the Peaceful Uses of Outer Space that it approve the activities planned for 1996 under the regular budget and take note of other program activities. As proposed in the annual report (A/AC.105/595) submitted by the Expert on Space Applications to the Scientific and Technical Subcommittee at its 1995 session, all these activities should be implemented as part of the recommendations on space applications from the Second United Nations Conference on the Exploration and Peaceful Uses of Outer Space (UNISPACE 82).",30.187272549878422,3.4074203968048096,30.564461699445665,3.4198379516601562,30.691462688222003,3.4239845275878906,29.51206030212893,3.384799003601074,27.894185298108567,3.328418254852295,30.26974263259377,3.4101486206054688
a046a70df29a39bbf66a13d137a7cd67,grok-3,"6. The initial programs of each center should focus on (a) remote sensing and geographic information systems, (b) meteorological satellite applications, (c) satellite communications and global positioning systems, and (d) space and atmospheric sciences.",12.608781920081396,2.534393548965454,12.744310711433029,2.5450849533081055,12.741703961837219,2.5448803901672363,13.219845666078692,2.581719160079956,11.125908475564144,2.4092764854431152,12.777235604455333,2.5476651191711426
6963482ac203932a7708c096e2def1cc,grok-3,"It should be emphasized that the overarching goal of the center is to assist participating countries in developing and enhancing the knowledge and skills of their nationals in relevant fields of space science and technology, so that returning scholars can effectively contribute to their countries’ development programs.",28.786414986267562,3.359903573989868,26.442452553263475,3.274970769882202,27.830552924843854,3.326134443283081,29.484427924350427,3.383862257003784,21.253207514771344,3.0565078258514404,29.392182029507445,3.3807287216186523
913cb332e116155adbaa3cc29fad9a66,grok-3,"A council established in this manner is essential for each center, as the member states and their citizens are more familiar with their own needs, aspirations, capacities, and resources, and are better equipped to find solutions to any local issues that may arise.",25.1236162082573,3.2238082885742188,25.608173483447633,3.2429115772247314,26.310629989307312,3.269973039627075,26.133522565784464,3.263218879699707,23.539277888217622,3.158670425415039,24.978005149835415,3.2179956436157227
8944878597f5ed4746f80ec89eb23cd4,grok-3,"13. Given that the United Nations General Assembly, in its resolution 45/72, specifically limited the role of the United Nations to leading international efforts to establish such centers, once the location of the center is determined, its governing council will exercise all decision-making authority over the center.",19.451600668334237,2.9679293632507324,20.006305458594603,2.9960474967956543,20.422204846352965,3.01662278175354,21.439257280774825,3.0652236938476562,18.243321302207757,2.903799057006836,19.78418401885069,2.9848828315734863
696a524e7819911deae123f4d8dc6f49,grok-3,"18. After considering the work of the Fourth Committee, the General Assembly, in its resolution 50/27 of 6 December 1995, endorsed the Committee's recommendation that ""these centres should be established at the earliest possible date under the affiliation of the United Nations, as such affiliation would provide the necessary recognition to the centres and could enhance the possibilities of attracting donor countries as well as establishing academic relationships with national and international space-related agencies.",33.47013322978706,3.510653495788574,34.05553202023542,3.5279924869537354,34.317420595408265,3.5356531143188477,34.62162256299604,3.544478416442871,31.66599363501035,3.4552433490753174,32.88762969789043,3.4930965900421143
ec863d3f34507f33925ba1b2bff911ea,grok-3,"19. During the period from 1995 to 1996, the Space Applications Programme secured 15 long-term fellowships provided by relevant parties: 10 from the Government of Brazil and 5 from the European Space Agency (ESA).",24.83264003765065,3.2121589183807373,23.910417926842648,3.174314260482788,24.10602904386289,3.182461977005005,25.103312540937136,3.2229998111724854,21.436870335100892,3.065112352371216,24.84099535701721,3.2124953269958496
f14d9dac2a071dcdf51a0f744ead2c6d,grok-3,"A preliminary study on the feasibility of establishing a transnational Andean organization has been completed, and this study will contribute to the operation and utilization of the Cotopaxi ground station and its services.",31.67313651459985,3.4554688930511475,31.229468197223838,3.441362142562866,32.11728778418124,3.4693944454193115,32.52933215038855,3.482142210006714,30.053192156658774,3.4029688835144043,31.626532991317656,3.453996419906616
22ae4d3c0324b4219501b761ebcd0837,grok-3,"25. Within the framework of the Space Applications Programme, the Office for Outer Space Affairs has responded to a recommendation adopted at a regional conference hosted by the United Nations in Dakar in 1993 concerning the establishment of effective communication links among African scientists and professionals. It has proposed a project called COPINE, which aims to create a cooperative information network connecting scientists, educators, and professionals in Africa.",24.21545860973374,3.1869912147521973,24.762763404314807,3.209341049194336,24.83083433166511,3.2120862007141113,25.807857920393985,3.2506790161132812,20.270690314509153,3.009176015853882,24.976153144923213,3.217921495437622
81f70e88ff42f27b5ef1b02251b48452,grok-3,"However, COPINE's focus is on leveraging its broadband capabilities to provide various information transmission services, particularly computer file transfer, interactive data transmission, document delivery, and imaging and video transmission, including video conferencing, distance education, and telemedicine.",38.653131741358976,3.654627799987793,39.31279488479846,3.6715500354766846,38.953867943473654,3.6623780727386475,39.43171027971508,3.674570322036743,38.63378377335399,3.6541271209716797,38.43877388073752,3.649066686630249
82d9d61273d70e6782bda2fb6954325e,grok-3,36. The implementation of the above-mentioned activities may be influenced by the decision of the United Nations General Assembly regarding the preparations for the Third United Nations Conference on the Exploration and Peaceful Uses of Outer Space.,12.81194991612455,2.5503783226013184,12.906033458114523,2.557694911956787,13.026290131045156,2.566969633102417,13.414242999006058,2.5963170528411865,10.942561414841089,2.392659902572632,12.920904113017382,2.5588464736938477
b78b9e2c05b10cd2799f3281152b87f1,grok-3,"To this end, space application experts and their staff may undertake duty travel as appropriate, within the biennial travel budget approved by the General Assembly at its fiftieth session for the Office for Outer Space Affairs, and, if necessary, may utilize voluntary contributions.",50.243650657629814,3.916884183883667,50.05564517678936,3.913135290145874,50.25734454305198,3.91715669631958,50.82527858658493,3.928393840789795,41.14808508524188,3.717177391052246,50.850586623648354,3.928891658782959
78624866cf10bcc49f96730e741a52d0,grok-3,"3. In the process of implementing the decisions contained in the above-mentioned General Assembly resolution and translating them into practical programs, the Office for Outer Space Affairs (hereinafter referred to as OOSA) invites all Member States in Africa to promptly indicate their interest in serving as the host country for the regional center.",22.880843795680747,3.1303000450134277,23.193095301764984,3.1438546180725098,23.56670946234718,3.15983510017395,24.574018349619788,3.2016897201538086,18.918512927087875,2.940140962600708,23.735672243460748,3.1669790744781494
6b8421aea8217464c7bb5bcf9f3cad5c,grok-3,"6. The programs of these two centers will be coordinated by their respective governing councils, which will be composed to ensure regional representation. The governing council of each center serves as its comprehensive decision-making body; it will oversee all aspects of the center's operations, including the approval of academic programs and decisions regarding its budget, personnel, and future development directions.",21.070590759771225,3.0478782653808594,22.052074459115122,3.0934066772460938,22.284909177951388,3.103909730911255,23.114139206388103,3.14044451713562,20.11840993502068,3.0016353130340576,21.586080034341755,3.0720486640930176
8494d4541632454ef44d705482083d86,grok-3,"Both draft agreements should include issues such as the specific purposes and objectives of each center, as well as their personnel and governing council structures, as outlined in United Nations document A/AC.105/534 dated 7 January 1993. Additionally, they should incorporate provisions regarding the future development direction of these two centers as regional institutions.",47.688171474246914,3.8646833896636963,48.81266263596895,3.8879897594451904,48.7850771015447,3.8874244689941406,48.541500348281204,3.8824191093444824,46.27921568521393,3.83469295501709,48.90180837256309,3.8898143768310547
6245d65c0a75e88ac997e079b264e9d6,grok-3,"Due to the limited number of copies of the report received, they were distributed only to committee members.",17.767044764170183,2.877345323562622,17.604864716062774,2.8681752681732178,17.45690877953951,2.8597354888916016,17.573169884980995,2.866373300552368,16.758132409911074,2.8188836574554443,17.63374079658479,2.869814157485962
0c9784bf6ec83f7a1fe845ae43555cef,grok-3,"14. Indigenous communities are tribal groups living in and around jungle areas, primarily concentrated or dispersed in provinces such as Loreto, Junín, Ucayali, Amazonas, Cusco, and Madre de Dios.",54.269158872774305,3.9939560890197754,54.77740429972605,4.003277778625488,55.20884524487585,4.011123180389404,56.92267041988931,4.041693687438965,50.991902777150486,3.931666851043701,54.76311857659448,4.003016948699951
780683c689075de0a72a7f5497ec88a9,grok-3,"In Peru, the population reached this figure at a time when the growth rate, which had previously remained high, was beginning to decline, resulting in a period of decreasing population growth.",21.369185797289724,3.0619499683380127,21.514631000291548,3.0687332153320312,21.770740363281092,3.080566883087158,21.335037120146712,3.0603506565093994,19.396389431125606,2.9650869369506836,20.984636586104738,3.043790578842163
49a1412dff76194a5cc7c97451d251d4,grok-3,"The population density of Lima and the Constitutional Province of Callao exceeds 100 people per square kilometer, while larger provinces or those located in jungle areas or on the edges of jungles, such as Pasco, Amazonas, Moquegua, Ucayali, Loreto, and Madre de Dios, have a population density of fewer than 10 people per square kilometer. This indicates that the population remains concentrated in the central region.",24.566502527233833,3.2013838291168213,25.113219829487843,3.2233943939208984,25.064098925282433,3.2214365005493164,24.16443503581166,3.1848819255828857,24.610041824751313,3.2031545639038086,24.67548667320175,3.205810308456421
f3034cac61216f8b860dce8fe449891d,grok-3,"The reduced demand that limits growth in the formal sector also affects the informal sector; consequently, under the pressure of an increasingly abundant labor supply due to population growth, the expansion of the informal sector ultimately leads to a decline in the average income of its members.",24.698688733081624,3.2067501544952393,25.676860327600064,3.2455902099609375,25.314669223797047,3.231384038925171,26.005248864858494,3.258298397064209,23.655630437009307,3.1636011600494385,25.083007341268033,3.2221906185150146
ac8457e4960fa8f0a4f5e7a6f1350720,grok-3,"Peru has pointed out to the international community that, while the issue is being studied from a global perspective and legal and political standards for multilateral organizations to prevent this problem have been determined, it is crucial to start taking urgent action to support countries in preventing such internal migration flows from turning into refugee flows.",39.423748222944184,3.674368381500244,39.34278085136385,3.6723124980926514,39.1641786053718,3.667762517929077,39.64731361630186,3.680023193359375,41.15136191201488,3.717257022857666,38.331908631975324,3.64628267288208
df25e292fc3601c48dc886882ed08cb0,grok-3,"The action plan adopts targeted interventions in specific regions based on poverty levels, with a focus on building basic institutional capacity for healthcare services, improving the quality of primary education to achieve universal primary education, and strengthening criminal justice systems, among other priorities.",30.985286081192037,3.4335124492645264,31.051711416429782,3.4356539249420166,31.16671951923937,3.4393508434295654,32.58034188766939,3.4837090969085693,29.957888270561735,3.3997926712036133,30.83465357270171,3.4286391735076904
a6a4f6d3a6f5296ffda573907eda136d,grok-3,"57. Under the government's new stabilization program, an emergency social program was implemented starting in August 1990 and lasting until March 1991, aimed at providing temporary assistance to the poorest people in Peru.",26.40309845588198,3.2734813690185547,27.241528027356686,3.3047425746917725,26.969409579528204,3.294703245162964,28.76570925017267,3.3591840267181396,24.283136606737603,3.18978214263916,26.77044394132489,3.2872984409332275
74f5d492449dc3e7eb64d2f1d2377223,grok-3,"Furthermore, the collusion between the Tupac Amaru Revolutionary Movement and drug traffickers, along with their attacks on banks and the extortion of war taxes from shops and merchants, has contributed to the internal disintegration of this terrorist group. In recent years, the group has virtually transformed into a criminal organization.",37.95676193502696,3.6364476680755615,38.67707212968528,3.6552469730377197,38.58587939213103,3.652886390686035,38.80923625336547,3.658658266067505,40.76947600656469,3.7079336643218994,37.91625946339529,3.6353800296783447
a0aabdd3671bc2c12f39c984f5e540b5,grok-3,"79. Peru is a country shaped by thousands of years of pre-Columbian development and 500 years of Western cultural influence; therefore, its Constitution establishes Peru as a multi-ethnic and multicultural nation.",30.834697682059012,3.428640604019165,31.228544945877587,3.4413325786590576,31.218405868421385,3.4410078525543213,33.063549240193744,3.498431444168091,28.82034611926432,3.361081600189209,31.77300315950609,3.4586169719696045
93af500547c62d9a3327ad715928c0cb,grok-3,"81. The individual rights established in the Constitution were already included in the main provisions of the 1979 Constitution; however, to strengthen national integration, some new concepts have been incorporated.",31.70227590798771,3.456388473510742,32.885928240143286,3.493044853210449,33.539110659249765,3.512712240219116,34.93297664094438,3.553431272506714,30.99897808344425,3.4339542388916016,32.172038564811544,3.471097707748413
cb9cb4efc164b133fc622fcf6fb653fa,grok-3,"(o) When national interests require, issue emergency decrees with legal effect to order the implementation of extraordinary economic and financial measures, with the responsibility to report to the Congress, which may amend the aforementioned emergency decrees;",44.330574750850126,3.7916746139526367,44.901127675428164,3.8044629096984863,45.04596747616026,3.8076834678649902,45.90677505934568,3.826612710952759,43.5323464015365,3.7735042572021484,43.41915600452071,3.7709007263183594
