sentence_id,text_source,text,ppl_grok-3_model,nll_grok-3_model,ppl_gpt-5_model,nll_gpt-5_model,ppl_gpt-5-mini_model,nll_gpt-5-mini_model,ppl_human_model,nll_human_model,ppl_pooled_ai_model,nll_pooled_ai_model,ppl_llama-3.3-70b-instruct_model,nll_llama-3.3-70b-instruct_model
73d6bc7a9613e548b074cf5d5228d1d4,human,"Strongly condemning the ongoing violence in Rwanda and particularly condemning the very numerous killings of civilians which have taken place in Rwanda and the impunity with which armed individuals have been able to operate and continue operating therein,",34.07940350968026,3.528693199157715,33.396997653394415,3.5084660053253174,33.3947841615567,3.508399724960327,33.19891595256418,3.5025172233581543,33.26378129489533,3.504469156265259,33.43443424187594,3.5095863342285156
5025664a2e78351860b1d58f8eebab07,human,"8. Encourages the Secretary-General to accelerate his efforts, in conjunction with the Secretary-General of the OAU, to obtain from Member States the necessary personnel to enable deployment of the expanded UNAMIR to proceed urgently;",39.83079702095976,3.684640407562256,38.5336059605248,3.6515307426452637,38.95030177359774,3.6622865200042725,38.958131059297706,3.662487506866455,35.05536380213875,3.5569286346435547,39.44194957270586,3.6748299598693848
b440020418838b652e51ed9936842234,human,"13. Decides that all States shall prevent the sale or supply to Rwanda by their nationals or from their territories or using their flag vessels or aircraft of arms and related matériel of all types, including weapons and ammunition, military vehicles and equipment, paramilitary police equipment and spare parts;",41.90171542277715,3.7353267669677734,40.409955411602915,3.6990761756896973,40.85370094220421,3.7099974155426025,42.70657151315091,3.7543528079986572,41.048913039730365,3.714764356613159,41.802879760176616,3.7329652309417725
5d8e7c98add52fa01e03d47e7c490efc,human,"14. Decides also to establish, in accordance with rule 28 of the provisional rules of procedure of the Security Council, a Committee of the Security Council consisting of all the members of the Council, to undertake the following tasks and to report on its work to the Council with its observations and recommendations:",15.768359684482535,2.758005380630493,14.734363922107038,2.6901824474334717,15.12116905112916,2.7160956859588623,15.077814288753421,2.713224411010742,14.669563001977638,2.685774803161621,15.23335780346792,2.723487615585327
83fa315cdb4c69a8b9447b048d1a21ae,human,"15. Calls upon all States, including States not Members of the United Nations, and international organizations to act strictly in accordance with the provisions of the present resolution, notwithstanding the existence of any rights or obligations conferred or imposed by any international agreement or any contract entered into or any licence or permit granted prior to the date of the adoption of this resolution;",16.02504029510533,2.7741525173187256,15.3665488328995,2.7321929931640625,15.577769112472243,2.745844841003418,15.99313513993812,2.7721595764160156,15.074845250660443,2.7130274772644043,16.036078182023367,2.774841070175171
7576b1dc6ca9f03092ca964998c4b1e0,human,"In that resolution, the Assembly decided, inter alia, that the United Nations Programme on Space Applications should disseminate, through panel meetings and seminars, information on new and advanced technology and applications, with emphasis on their relevance and implications for developing countries.",21.863479627866965,3.08481764793396,21.65547898697734,3.075258493423462,21.852931749731376,3.0843350887298584,21.95856663565786,3.0891573429107666,18.67381202896874,2.927122116088867,21.675846538299712,3.0761985778808594
b6ad6e82032114a6d36499955b487d77,human,"The presentations to the Workshop covered the use of remote sensing, satellite meteorology, satellite positioning systems and satellite communications and how they could be used, separately or collectively, to prevent disasters or to forecast, monitor and mitigate the effects of severe weather phenomena, such as flooding, desertification and drought.",21.3382979242885,3.0605034828186035,20.770660560386663,3.033541440963745,20.580415389183273,3.0243399143218994,20.92298373865818,3.0408482551574707,18.457729693234946,2.915483236312866,20.878220641441878,3.0387065410614014
94635c5d11963a7ca2bfee7b7694af2a,human,"Opening addresses were made by Prof. C. J. Chetsanga, Director-General of the Scientific and Industrial Research and Development Centre of Zimbabwe, on behalf of the Government of Zimbabwe, C. Berquist, the representative of ESA, and the Expert on Space Applications, Office for Outer Space Affairs of the United Nations.",26.34627816069633,3.271327018737793,26.06513040030822,3.2605984210968018,26.157316038691803,3.2641289234161377,26.729645753182744,3.285773277282715,23.43770915519678,3.154346227645874,26.466678737045534,3.2758865356445312
d5f8a8d821893a1c2aa37ff1b785f777,human,The Workshop noted that many of the national and regional emergency response agencies and services were not aware of the full spectrum of applications of space technology. Of particular concern was the lack of awareness of the Earth observing systems that could provide essential data for the prevention of disasters or for the mitigation and relief of their effects.,26.637081515697325,3.282304286956787,26.199751640069188,3.265749931335449,26.676784367303135,3.2837936878204346,25.770099548536052,3.2492148876190186,23.658185468616985,3.1637091636657715,26.400618346618934,3.2733874320983887
0b180603593bceaffe671ce5b1c465d7,human,"During the last session of the Workshop, the participants defined four categories of disaster-related topics that needed to be addressed: data supply, information generation, decision-making and implementation/execution.",26.0404336083036,3.259650468826294,25.86206180341891,3.252777099609375,26.121786530356196,3.2627696990966797,25.887348575224138,3.2537543773651123,24.71453421843312,3.2073915004730225,26.113019091750736,3.2624340057373047
9622416ee42a38a745dbb9a7ff207e41,human,"A single hazardous event can destroy the social and economic infrastructure, including communications systems, that may have taken years to develop and upon whose vitality local and national economies depend.",51.28193729292219,3.9373385906219482,49.978407042945115,3.911591053009033,49.40486846080629,3.9000489711761475,51.24326702354325,3.936584234237671,47.37282146532486,3.858048677444458,51.11335388924621,3.9340457916259766
2770cc454b7152804c44d763786d405c,human,"Importantly, it directs the disaster management community beyond the issue of simply using state-of-the-art space technologies in disaster relief and early warning because it promotes a recognition that the national infrastructures that make possible these applications must be encouraged and supported.",37.77888487011924,3.6317503452301025,37.464212524764335,3.6233861446380615,37.221733130921464,3.6168928146362305,37.727057064435755,3.6303775310516357,36.10717448457895,3.586491584777832,37.47059063294694,3.62355637550354
4fa44cc76755cf42166be3136500796f,human,"The project is using satellite image data to map land use at the scale of 1:250,000 as a part of the Environmental Information Systems Development component of the Ghana Environmental Resources Management Project (GERMP).",50.68379583645426,3.9256062507629395,52.612855006513605,3.9629604816436768,52.85757651395185,3.9676010608673096,51.27609332708384,3.9372246265411377,47.393698412477605,3.8584892749786377,51.177701851380135,3.9353039264678955
332458484f646fef858c2e311b945143,human,The advanced very high resolution radiometer (AVHRR) instrument carried by satellites of the National Oceanographic and Atmospheric Administration (NOAA) of the United States of America is the only commercial data source available to satisfy the needs and requirements of a fully operational exercise of this magnitude.,24.84727998253006,3.2127482891082764,24.569507408742865,3.2015061378479004,24.831035616977076,3.212094306945801,23.911335755204856,3.1743526458740234,22.979347343971824,3.1345958709716797,24.940919773705012,3.2165098190307617
09ee9e4e184aad60b5c6b9febbe51692,human,"The growing awareness and consideration of these societal issues together with advances in spaceborne technology mean that effective, affordable and global mobile satellite communications and remote sensing capabilities that should significantly reduce the devastating effects of natural disasters should soon be implemented.",51.329055660722446,3.9382569789886475,52.959424902338505,3.9695260524749756,51.953512632638144,3.9503493309020996,51.480820264439735,3.941209316253662,46.85330637073299,3.8470215797424316,51.74152707333535,3.946260690689087
c6953f899b3caabff9ec4992c6c5c366,human,"National contingency plans can help to minimize the impact of sudden natural disasters, for example by the pre-positioning of emergency supplies and communications equipment, including satellite communications systems, at strategic locations such as government premises and hospitals in areas known to be at risk.",19.567742835267072,2.9738824367523193,19.41929864912351,2.9662673473358154,19.727182163262693,2.981997489929199,19.59126080590353,2.975083589553833,18.887541978011463,2.938502550125122,19.302896184515365,2.9602551460266113
339c2f627dc5927c9b0ec120fb2f2653,human,Lists and reports can be compiled quickly and transmitted via mobile satellite communications systems to disaster relief coordinators and other agencies using existing software programs for the management of personnel and supplies.,50.14718051133604,3.9149622917175293,51.20849603910336,3.9359054565429688,50.779349068621364,3.927489757537842,50.981278301678465,3.9314584732055664,44.787442775756666,3.8019278049468994,50.160644796545014,3.9152307510375977
3418ec89a2b724082814da1966d9562b,human,"Using Inmarsat mobile satellite communications systems and GPS, operations control is able to monitor the progress and location of all equipped vehicles, as well as send messages to them, regardless of the state of the local infrastructure, weather conditions and other impediments.",33.17657084266887,3.5018439292907715,32.986417827773174,3.496095895767212,33.54760385507362,3.512965440750122,33.82062952164616,3.521070957183838,30.08899667339552,3.4041595458984375,32.57406614304931,3.4835164546966553
d053e77ef42c1c90fd345616a349e19f,human,"It is therefore increasingly used by FAO in its programmes and field projects being conducted on the basis of the recommendations contained in Agenda 21.1 However, until now, remote sensing has been largely technology-driven.",34.36615389737904,3.53707218170166,34.51586347533081,3.54141902923584,34.0171242357888,3.5268640518188477,33.946289609579885,3.5247795581817627,33.5935058932205,3.5143327713012695,34.7228458425353,3.5473978519439697
cddf1da76e159c360913488902330e3e,human,Such products are disseminated within three hours from data sensing to nominated centres through the global meteorological network for subsequent assimilation into numerical analysis and forecast models.,188.18873229713273,5.23744535446167,184.42734508498114,5.217255592346191,186.08275994424608,5.226191520690918,179.39857463684575,5.189610004425049,167.43775456015138,5.120611667633057,187.81419108735943,5.235453128814697
032e47b1c4c5af214757515a6664327d,human,Both systems therefore concentrate on observing environmental changes that occur over short periods (e.g. oil pollution and red tides) and the simultaneous observation of phenomena occurring globally over the surface of Earth (e.g. wind speed and direction of sea surface).,36.48011023953091,3.5967671871185303,37.69973167255385,3.629652976989746,37.52373904747628,3.624973773956299,36.32751022430558,3.5925753116607666,36.0891697394549,3.5859928131103516,36.69755923680528,3.602710247039795
be1d7c45f5e7aa1f9673feeab6eb2df3,human,"The payloads of the satellite segment of both systems would be designed to monitor the land and ocean environment, the geosphere, hydrosphere and meteorological conditions, with the aid of visible, near infrared, microwave, short-wave and thermal radiometers, synthetic aperture radar, radar altimeter and scattering lidar.",33.32737487202771,3.5063791275024414,32.95797606457377,3.4952332973480225,33.14095582419234,3.500769853591919,31.739091615962028,3.4575490951538086,31.629421078398597,3.454087734222412,32.947094816774225,3.494903087615967
b1942f169e129f6fd766e52463eee0d7,human,"After a modest beginning with small, simple and lightweight satellites, space systems evolved into large, complex and expensive space platforms for scientific research and other applications that often require many years of development prior to launch.",34.23951101283192,3.5333802700042725,35.47822690939186,3.5689191818237305,35.78967229885036,3.5776593685150146,35.1293083592156,3.5590357780456543,31.124771608431196,3.4380040168762207,34.336776270543645,3.536216974258423
6aa97b79ef4437a722d0310cd3f4b5dd,human,Launch costs represent a large portion of total programme costs (generally over 25 per cent) and satellite mass and size must therefore be constrained to take full advantage of low-cost launch opportunities.,33.512357561211935,3.5119142532348633,33.059986332253615,3.498323678970337,32.744560867433044,3.488736867904663,32.83807260947789,3.491588592529297,35.655879319322146,3.573914051055908,33.252521602081984,3.5041306018829346
66bc4fdb5581bf91ddd078c85963c850,human,"At one extreme, low data rate sensors with only local or regional coverage on missions with low tracking and command requirements impose relatively low demands on the ground segment, possibly comprising only 10 per cent or less of total programme costs.",99.50494374368107,4.600207328796387,100.5674731138448,4.610828876495361,99.01181262341905,4.595239162445068,96.14742424960458,4.565882682800293,95.04653260674779,4.554366588592529,98.02174506729706,4.585189342498779
8eb8d74b5e5ecec585014349488c8719,human,"A university environment is often an ideal environment for the development of space activities and, because such projects often require the creation of new laboratories, these facilities are a lasting, beneficial by-product of such projects.",31.580750974776098,3.452547788619995,32.43379965961934,3.479201078414917,32.02083533185736,3.4663867950439453,32.426106415848444,3.478963851928711,28.93623632309565,3.3650946617126465,31.080456939904746,3.4365792274475098
6672ac27461c36848fd3d01e4b1ab678,human,"Ten different experiments, provided by scientists from Austria, Czech Republic, Hungary, Poland and Slovakia, will be accommodated on the spacecraft, which is being funded by the Italian Space Agency (ASI) and designed by Alenia Spazio.",17.649803991841694,2.870724678039551,17.344079670515434,2.8532512187957764,17.57003621630866,2.8661949634552,17.24518934466189,2.8475332260131836,17.996413382908475,2.8901724815368652,17.440559578264132,2.8587985038757324
f2b5b957b99f9c990c9a60d68626c9f4,human,"(c) Mission IBIZA: registration of the plasma accelerated in the geomagnetic auroral regions, interaction of ionized particles with the ionosphere and magnetosphere of Earth, creation of electromagnetic disturbances;",118.02741627376982,4.770916938781738,117.70615861579019,4.768191337585449,118.53739736510457,4.775228500366211,108.90847915939736,4.690507888793945,102.17851004646909,4.626721382141113,117.12053532133136,4.7632036209106445
d3aa71a72c4758da75eceb34c42c6572,human,"The latest additions to the UOSAT family are a Portuguese satellite (POSAT-1), HEALTHSAT-2 and KITSAT-2, which were launched together in September 1993 aboard Ariane V-59, together with the SPOT-3 commercial remote sensing satellite.",53.58710497109853,3.9813084602355957,52.79015981551883,3.966324806213379,53.74540499542628,3.9842581748962402,51.41432597717211,3.9399168491363525,46.24330349247421,3.833916664123535,53.962757062943204,3.9882941246032715
7fe45f7de165b5b93be1fec583bb8d14,human,"In addition, large satellites are essential where specific instruments must be large enough to achieve their mission objectives with high power and very high data rates (e.g. depending on the size of radar antenna or optical performance on aperture and focal length).",44.01083039867839,3.784435749053955,44.03349061654465,3.7849504947662354,44.01916262903833,3.7846250534057617,42.68130716551469,3.753761053085327,40.246558228458966,3.6950244903564453,43.22071914699208,3.766319990158081
3f49bc214d4e6337e603c4b0ba498369,human,"The pre-operational Fire Reconnaissance System (FIRES), recently studied in Germany, will demonstrate the feasibility and usefulness of a future operational small satellite system for fire reconnaissance.",53.039714552693994,3.971040964126587,54.157870278389666,3.991903305053711,54.973942625412754,4.006859302520752,54.42406259254367,3.9968063831329346,50.99946525125792,3.9318151473999023,53.416750690028984,3.9781243801116943
badea0a92ece150914e03ff0e0743045,human,"A satellite health network has been proposed for western Africa by a non-profit agency in the United States, Volunteers in Technology Assistance, using a constellation of small LEO communication satellites to link regional medical centres with village clinics and mobile health teams.",66.13348411582305,4.191675186157227,66.14878031227464,4.191906452178955,65.92976770386325,4.188590049743652,65.88416728671625,4.1878981590271,63.39391058630217,4.149367809295654,63.78673380765551,4.155545234680176
fa5ff050966c7bd7c78775f4d58e2714,human,"It has been estimated that 10 microsatellites could be built and launched for about US$ 21 million, while about US$ 30 million would be required for the medical facilities and the Earth station network.",25.14164040075736,3.2245254516601562,25.08108177308236,3.222113847732544,25.17183349085848,3.2257256507873535,24.780304205440896,3.2100491523742676,23.029707901593504,3.1367850303649902,24.250175924943395,3.1884238719940186
e3bd1e8356b6174df19c625241d84683,human,"There is always an emphasis on the active participation of members of the university community (professors, students, postgraduates), which gives them invaluable practical experience with space technology and scientific research.",22.266389970571197,3.1030783653259277,22.247827805697575,3.1022443771362305,22.64065989653848,3.1197474002838135,22.921095027599254,3.1320576667785645,20.88277080590681,3.0389244556427,22.25528689529667,3.1025795936584473
b364effb8c1b035024c9e4375f2d1b1d,human,"The eventual success of small satellites and microsatellites is not considered to be in doubt; however, before the full potential of these emerging technologies can be realized, it will be necessary to radically rethink the way missions are specified, realized, funded and operated.",18.573910531557768,2.921757936477661,18.74575507776763,2.930967330932617,18.547111702527417,2.920314073562622,18.947537845021774,2.941673994064331,18.2520572830522,2.904277801513672,18.71840037108143,2.92950701713562
d2bd79d5f1779429b77f02c73d97c636,human,"Because of the diverse nature of both applications and instruments, their needs are unlikely to be met with a common small satellite bus design, but more intensive exchange of experience with different designs could eventually lead to some kind of standardization.",57.60283015036926,4.053571701049805,58.64661541586402,4.071529865264893,59.18851840446315,4.080727577209473,57.77996304816403,4.056642055511475,56.27471397262121,4.030245304107666,56.55995401152253,4.035301208496094
8799e59fda9a4ee4391fb1b1901b9d93,human,"Through panel discussions, the Workshop developed general principles on how developing countries could use space technologies, including remote sensing and space communications systems for health care, environmental monitoring and economic and social development.",32.1604199895187,3.470736503601074,31.697499351747588,3.45623779296875,31.914147659572322,3.4630494117736816,32.62202702265538,3.484987735748291,26.646145613623954,3.282644510269165,31.6341798336176,3.454238176345825
6d022151fb79dbc4464720d851867794,human,"Funds allocated by the United Nations, IAF and the other co-sponsors for the Workshop were used to cover international air travel and per diem expenses for the period of the Workshop and the IAF Congress for selected participants from developing countries.",33.1778206321276,3.5018815994262695,33.260498145692736,3.5043704509735107,33.709697282789904,3.5177855491638184,33.55059537959082,3.513054609298706,30.960171486536453,3.432701587677002,33.048543482101145,3.4979774951934814
b6208ab60e1c83000ef24b311d68b82f,human,"Speakers, chairmen and participants from Austria, Canada, France, Germany, Italy, Malta, Netherlands, Norway, United Kingdom of Great Britain and Northern Ireland and the United States of America also took part in the Workshop. I. PRESENTATIONS AND DISCUSSIONS DURING THE WORKSHOP",11.215672665154026,2.4173121452331543,10.994227237350568,2.3973703384399414,11.136417824147145,2.4102206230163574,10.503228257071141,2.351682662963867,10.51353544497863,2.352663516998291,11.163064665444507,2.4126105308532715
65de4111b88b7d922f16e73b4717b63a,human,"Space technology had become an increasingly vital part of everyday life, characterized by growing costs and complexity, which meant that most developing countries must be extremely selective about the scope and pace of their own space activities.",31.729800467904777,3.457256317138672,31.562226463555934,3.451961040496826,31.132304554540617,3.438246011734009,31.336593893364242,3.444786548614502,30.613667568782404,3.4214465618133545,31.268575065284665,3.4426136016845703
aea216202072edcebdb5d32c90243029,human,"Although the European Remote Sensing (ERS) satellite system of ESA was not specifically planned to meet the needs of developing countries, its data played a vital role, in particular in the fields of environmental monitoring, food production and climate change.",21.51207666703469,3.0686144828796387,21.66327662399484,3.0756185054779053,21.44285609094009,3.0653915405273438,20.75864031343915,3.0329625606536865,19.605591758244802,2.9758148193359375,21.271654909697364,3.057375431060791
a14cfad03bdc1dcbae124757f567deb2,human,"Remote sensing satellites were useful in formulating disaster mitigation measures and in monitoring, and could assist in risk analyses by promoting understanding of the processes that led to natural disasters.",48.516520248860374,3.881904363632202,47.80107004527315,3.8670480251312256,47.87011526174921,3.8684914112091064,47.04893276751697,3.8511881828308105,43.70692646520038,3.7775065898895264,48.02431472502177,3.8717074394226074
eb3bdfcf3805a39551e363ddc46d3fa0,human,"Combining the fuel type with other parameters enabled fire-suppression authorities to combat forest fires more effectively, thereby dramatically reducing annual losses and achieving significant savings in fire-suppression costs.",42.8448429722074,3.757585287094116,44.69512925917897,3.7998645305633545,43.19436795905176,3.7657101154327393,44.455636880681936,3.794491767883301,40.03588520966242,3.6897761821746826,43.31854843224081,3.768580913543701
1f0fc53f16b4d279603a05a8d986cfef,human,"One of the future UN/IAF Workshops should focus on the means of overcoming the regulatory, legal, political, financial and educational obstacles to the better exploitation of space technology in developing countries.",39.8105748198061,3.6841325759887695,40.06417792249277,3.6904826164245605,40.535195054410416,3.7021706104278564,37.95126017867307,3.6363027095794678,41.09193887551935,3.7158119678497314,38.71556266896886,3.6562416553497314
1af64f124b14270b58d42def3d4724d5,human,"Whereas some telehealth applications required real-time capability (video conferences for telesurgery, telepsychiatry etc.), other applications, such as image and file transfer, consultations or research, could be supported in a store-and-forward mode.",56.4831420364837,4.033942222595215,55.11791251438975,4.009474754333496,55.67744451326135,4.019575119018555,51.646662862894736,3.944425582885742,56.30493702845643,4.030782222747803,55.29599914441328,4.01270055770874
aadca9e110fbe675797d8e89da87b9e3,human,"However, not only technical, but also regulatory, legal and political issues must be addressed and resolved if support services for health care and education were to be developed. Those issues should not be allowed to inhibit the development of adequate, worldwide satellite services that were already feasible.",31.27289181357775,3.44275164604187,31.156726796420962,3.439030170440674,31.217951845796833,3.440993309020996,30.367117362565295,3.413360357284546,29.747199836682295,3.392735004425049,31.068928871932783,3.4362082481384277
ce0a304a818543805471e63cbc0bc539,human,"In connection with the joint TREES project of the Commission of the European Communities and ESA, a deforestation monitoring system should be developed, combining low- and high-resolution data and using the Tropical Forest Information System.",43.09203119677977,3.763338088989258,41.19217731405318,3.7182483673095703,41.93498582518518,3.7361204624176025,42.3498855757466,3.7459657192230225,39.015621834198065,3.6639621257781982,42.76023400465224,3.755608558654785
fc24f5995620d3bb7ffd8c05ff58d860,human,"Voice, fax and data terminals should continue to be positioned at strategic locations so that an uninterruptible source of warning would be available even if the local radio or television infrastructure had been disabled by a disaster.",40.09957432187346,3.6913657188415527,40.30735338274227,3.6965339183807373,39.65690922331906,3.680265188217163,39.515338363402975,3.6766889095306396,40.03989443591581,3.6898763179779053,39.448203524696446,3.6749885082244873
