sentence_id,text_source,text,ppl_grok-3_model,nll_grok-3_model,ppl_gpt-5_model,nll_gpt-5_model,ppl_gpt-5-mini_model,nll_gpt-5-mini_model,ppl_human_model,nll_human_model,ppl_pooled_ai_model,nll_pooled_ai_model,ppl_llama-3.3-70b-instruct_model,nll_llama-3.3-70b-instruct_model
a4677d152e03948123601446879ad9d0,gpt-5-mini,"The Kagoshima Space Center, situated in a hilly area of Uchinoura Town on the eastern coast of the Ōsumi Peninsula in Kagoshima Prefecture, occupies 71 hectares and contains various rocket launch, telemetry and tracking facilities, rocket and satellite control stations, and an optical observation station, all built atop several flattened hilltops.",35.45066236383315,3.5681419372558594,36.12000360881832,3.5868468284606934,35.86301101298279,3.5797064304351807,36.12671273050652,3.5870325565338135,33.55729928273421,3.513254404067993,35.3999016396695,3.566709041595459
2fd1d6dad1d78db5b60e3c596a2798e8,gpt-5-mini,"85. Satellite data can be used to improve weather-forecasting services, for the World Meteorological Organization’s International Satellite Cloud Climatology Project (ISCCP) and the Global Precipitation Climatology Project (GPCP).",18.20740769441097,2.9018285274505615,14.899633602877513,2.701336622238159,16.503750780352288,2.8035876750946045,18.386081056522126,2.9115939140319824,12.175051916905296,2.4993889331817627,18.280133811316993,2.9058148860931396
f7ee2bd8860ca3116369b5866016c0d3,gpt-5-mini,"The principal activities of the Ministry of Posts include researching and formulating concepts for long-range space communications and complex satellite systems, as well as promoting the use of satellites and pilot programmes for advanced satellite communications systems.",31.161035532994834,3.4391684532165527,31.43055065536883,3.4477803707122803,31.477548319692797,3.4492745399475098,31.81693979961855,3.459998846054077,30.47921928327322,3.4170451164245605,30.735376612025217,3.4254143238067627
850171495121095f2fc8d420db281f2b,gpt-5-mini,The Communications Research Laboratory conducts research and development on a range of space technologies to meet the diverse communications needs of the era of advanced information technology and human spaceflight.,27.266609828446157,3.3056628704071045,26.62546848020934,3.2818682193756104,26.589708803610225,3.280524253845215,27.242859511608096,3.3047914505004883,25.781235009480977,3.2496469020843506,27.0038385111651,3.2959790229797363
0052f2635990152a33cd93f82ba02e10,gpt-5-mini,"98. The N-STAR communications satellite (N-STARa), purchased from the United States by Nippon Telegraph and Telephone Corporation, was launched in August 1995 on an Ariane rocket to maintain the satellite communications services currently provided by the CS-3 satellite. (d) Broadcasting",36.56307456036809,3.59903883934021,35.81660379814483,3.57841157913208,36.802210766555554,3.605557918548584,35.63990097527391,3.5734658241271973,32.72450325006462,3.488124132156372,36.495586438018556,3.597191333770752
ebed5f569c0e747aafb7129b72d7a2f7,gpt-5-mini,"103. A 21‑GHz‑band multi‑beam antenna satellite broadcasting system will be developed for future satellite broadcasting services, such as high‑definition television, integrated‑services digital broadcasting, and provincial/regional satellite broadcasting.",63.65380301713592,4.153459072113037,56.49232702518865,4.034104824066162,51.991318149922265,3.9510767459869385,62.17161518794314,4.129898548126221,50.40723834850517,3.9201347827911377,62.63856087068748,4.137381076812744
99f9169849fa905561c6d7d5c719a711,gpt-5-mini,"115. The purpose of the Experimental Technology Satellite (ETS) programme is to develop the various advanced technologies required for the practical application of satellites (earth observation, broadcasting, communications, etc.), thereby promoting technological development in Japan.",21.09827903671301,3.049191474914551,21.993230912768922,3.0907347202301025,21.921730371650902,3.0874783992767334,22.714261619806575,3.122992992401123,17.933587617589726,2.8866753578186035,21.071655794192612,3.047928810119629
20473e74710bfec10778e4ae6c7690ee,gpt-5-mini,"The objectives of ETS‑VI are to validate the capabilities of the H‑II launch vehicle, establish the technologies for a two‑ton‑class, three‑axis‑stabilized satellite bus, and test advanced satellite communications equipment.",60.612679776789136,4.104504108428955,56.019193342334056,4.025694370269775,49.72396390725886,3.906486988067627,62.62321039773423,4.137135982513428,47.2569006191327,3.8555986881256104,59.67586968557097,4.088927745819092
5f3756290ee2a5bad910aa3966fc89e6,gpt-5-mini,123. Various space science projects and research activities being considered for near‑term implementation using the M‑V launch vehicle include: X‑ray astronomy; sample‑return missions to comet comae; lunar and Mars rover missions; Venus aerial imaging and balloon flight missions; asteroid sample‑return missions; infrared astronomy; solar physics; and atmospheric science.,77.58237645706264,4.351340293884277,71.61626767795843,4.271322250366211,65.55634261710678,4.182909965515137,75.40586344164842,4.322885036468506,61.5895357244674,4.120491981506348,77.15483354094383,4.345814228057861
d1b7ee3164c34c312fdeac6543d0547f,gpt-5-mini,"133. As a first step, following gliding trials of a small model aircraft in June 1986, several test flights were carried out in 1987, yielding useful data for further research in the two aforementioned areas.",37.70609593773602,3.62982177734375,38.473211226809596,3.6499621868133545,39.27750301846003,3.670651912689209,38.68712468835259,3.6555068492889404,34.48374331367251,3.5404880046844482,37.11934880487008,3.61413836479187
2f6308e9a071a87590ba7331781c1243,gpt-5-mini,"140. On the basis of the July 1979 correspondence between the National Aeronautics and Space Administration (NASA) and the Space Applications Center, meetings of the High-level Standing Liaison Group were held alternately at the two agencies to promote cooperative programmes between Japan and the United States in Earth observation, space science, life sciences and microgravity science, and to explore new cooperative projects.",19.662954842533576,2.978736400604248,19.36062911922978,2.9632415771484375,19.47323328690653,2.969040870666504,19.94779327730435,2.9931185245513916,18.238354795983273,2.903526782989502,19.374472635354984,2.963956356048584
0cbf3cbe7a564b0345dec7227bdeb444,gpt-5-mini,"At the private enterprise level, Japanese companies plan to participate in Germany’s D-2 program, a project using a space laboratory to conduct microgravity experiments. (c) Cooperation with the Russian Federation",69.29599469032242,4.238387107849121,53.35908981107841,3.9770443439483643,62.108709135828946,4.1288862228393555,66.89211722582887,4.203081130981445,43.755325404778795,3.778613328933716,71.25400921064136,4.266251087188721
e5768bb348cf27e9b3a21f69ebd09f2c,gpt-5-mini,"The proposed university-affiliated college will offer a five-year programme of study, comprising three years of general education followed by two years of specialised instruction in cartography, photogrammetry, geographic information systems and remote sensing.",20.654951138343762,3.0279550552368164,20.281378693618148,3.0097031593322754,20.28127231383235,3.009697914123535,20.919975932757797,3.0407044887542725,19.33187937182929,2.9617555141448975,20.204862053839143,3.005923271179199
b6276f113b42f3c8e980a8bb1e8a8993,gpt-5-mini,Satellite imagery and aerial photography are being used to investigate land-use degradation in the Greater Amman area during the period 1945–1994 caused by human activities and urban development.,48.25227173371671,3.8764429092407227,47.98374201726254,3.8708622455596924,47.22504849992696,3.854924440383911,49.2750223640177,3.8974173069000244,42.04749490342683,3.738799810409546,48.81462947151114,3.8880300521850586
c13a90f00025ca8b4921dc4ca183b71b,gpt-5-mini,"This research helps determine the correlation length of X‑ray jets in galaxies, the distribution of galaxies in the southern hemisphere, and the large‑scale structure behind the Milky Way.",48.24790032127786,3.876352310180664,46.05383766711954,3.8298110961914062,43.10602657642505,3.763662815093994,48.23332797324114,3.8760502338409424,41.28824997480516,3.7205779552459717,47.886826992949146,3.868840456008911
141666b2bd8690ede25e766cd5b1191c,gpt-5-mini,South Africa uses INTELSAT satellites to carry out public telecommunications services with foreign countries (including some African States) and to transmit South African broadcasting signals.,70.44896412499085,4.254888534545898,67.1343953036981,4.206696510314941,66.83839296131612,4.202277660369873,70.77344178107343,4.259483814239502,61.948812621116275,4.126308441162109,72.21858467256625,4.279697418212891
b5a53426d62b404a8be091453a7500f1,gpt-5-mini,Its primary research task is to test a three-color pushbroom imager with a 45-kilometre swath and 15-metre resolution installed on a microsatellite of the same size as SUNSAT. SUNSAT also carries a suite of amateur radio communications equipment for international and domestic use.,43.02213268523887,3.7617146968841553,41.682646707451134,3.7300848960876465,42.293884287547556,3.744642496109009,41.79682051677421,3.7328202724456787,38.884952008347454,3.66060733795166,43.54789680071243,3.7738614082336426
4df57008edb51ed2e6b2d7527bbab490,gpt-5-mini,"200. During 1995, some South African universities also participated in a number of other project activities; the work undertaken by the Institute of Space Physics at the Durban campus of the University of Natal is one example.",22.191202375528057,3.099695920944214,22.212010239718843,3.100633144378662,22.744299591317464,3.124314546585083,23.41119241238448,3.1532142162323,19.032116448407066,2.9461278915405273,22.342040056640627,3.1064701080322266
6b38b056ce2def33d79f8b9d87ddc956,gpt-5-mini,"SHARE and AMIGO are part of South Africa's national Antarctic research programme, which is carried out at the SANAE base in Antarctica in collaboration with other South African research institutions and with partners from other countries.",28.218774431407553,3.3399875164031982,27.011552596518364,3.2962646484375,26.950698319234153,3.294009208679199,26.813490661067142,3.288905143737793,27.305232800886152,3.3070783615112305,27.377263969803195,3.3097128868103027
492640afa35541a94727d10d308d95e7,gpt-5-mini,"Subsequently, the Republic of Korea also acceded to the agreement, and the four countries agreed on the following two space projects: the Small Multi‑Mission Satellite (SMMS) and the Satellite Disaster Mitigation System (SDMS).",19.530153233435747,2.9719595909118652,19.340440326937397,2.962198257446289,18.980964767249418,2.943436622619629,19.8925490026427,2.9903452396392822,17.08357711657806,2.8381175994873047,19.477918416057726,2.9692814350128174
df432ed5b75eea7fd2ef425658a9032d,gpt-5-mini,"1. To assess the implementation of the recommendations of the Second United Nations Conference on the Exploration and Peaceful Uses of Outer Space (UNISPACE ’82), the Working Group as a whole, in its report on the work of its ninth session (A/AC.105/605, annex II), recommended that the Secretariat prepare reports and studies and compile information provided by Member States.",39.18678179757188,3.668339490890503,36.527864849375774,3.5980753898620605,37.262932912243166,3.6179990768432617,38.141514214193705,3.641303300857544,32.42548794284929,3.478944778442383,38.868740593248596,3.6601903438568115
ff851a6f0202befe1c73df90f2ef106e,gpt-5-mini,Researchers using computer simulation techniques have further learned about the heliopause: it lies at the boundary of the solar system and is where the outward flow of the solar wind is counterbalanced by pressure from the interstellar medium flowing in the opposite direction.,23.049186192714757,3.1376304626464844,23.03209099312698,3.1368885040283203,23.21420610464806,3.1447644233703613,23.405488647492085,3.152970552444458,22.90956170594181,3.131554365158081,23.023509723971504,3.1365158557891846
cc73eb2949e89fa6d82082b16c9ed328,gpt-5-mini,"The most direct explanation of this result is that, within the volume delineated by these clusters, all the galaxies are moving at nearly 700 kilometers per second, and therefore any ""attractor"" must lie beyond the boundaries originally identified by the study.",44.496260389940254,3.795405149459839,44.45479956363495,3.7944729328155518,44.9467659794158,3.805478811264038,45.184993432178125,3.810765027999878,42.681480158147615,3.753765106201172,44.429221300776106,3.7938973903656006
8b35da17bd3ca52b99b6e22b3f5dd74c,gpt-5-mini,"Observations by Thomas L. Duvall (Goddard Space Flight Center), Stuart Jeffries (Bartol Research Institute), Jack W. Harvey (National Solar Observatory, Tucson) and Martin A. Pomerantz (Bartol Research Institute) indicate that it is also possible to directly measure the travel times and distances of individual acoustic waves, which is the principal method of terrestrial seismology.",24.724123019616542,3.2077794075012207,24.327994902917712,3.1916277408599854,24.513915181924492,3.1992409229278564,24.651395403255826,3.204833507537842,23.640621675258053,3.16296648979187,24.528770740930057,3.1998467445373535
7247af882c35a86eb1cb33499e94b6d3,gpt-5-mini,"Over the next two and a half months, the spacecraft used four cameras to image the lunar surface in 11 discrete spectral bands, capturing a total of 1.8 million images and performing coarse altimetry over most of the Moon, thereby producing the first comprehensive digital map of the lunar surface.",23.356483574503336,3.150874614715576,22.9723192425549,3.1342899799346924,22.96958636829581,3.1341710090637207,22.803385631882144,3.126909017562866,23.18834580604742,3.1436498165130615,22.645729142726914,3.11997127532959
895f0bfd1718ee5560811a7de7db9024,gpt-5-mini,"By tracking the spacecraft's precise velocity as it flew over specific regions of Venus, ground controllers calculated the gravity at those locations and thereby determined the density beneath the surface.",48.73852772361866,3.886469841003418,48.092008333155334,3.8731160163879395,47.8279167232826,3.8676095008850098,48.506851000029634,3.8817050457000732,44.49305666725591,3.79533314704895,48.443204697803026,3.880392074584961
fae3ac2bcdb839ae6c9b4c27d0c0995e,gpt-5-mini,"In this regard, the U.S. Geological Survey successfully completed the first full-resolution, full-coverage radar mosaic of Venus at a scale of 1:1,500,000; by the end of the fiscal year, a series of 170 compact discs containing data from the spacecraft had been put into production.",24.879302334813783,3.214036226272583,24.806739251318735,3.2111153602600098,24.91730005625227,3.215562343597412,24.928905037291887,3.2160279750823975,21.58882330515009,3.0721757411956787,24.812695754568253,3.211355447769165
bd3967001600dde86924eaa005e0fd10,gpt-5-mini,"A major finding of SLS-2 is that three independent research teams have each demonstrated that the models currently used to understand the effects of gravity on the heart, lungs and circulatory system cannot predict the various physiological responses observed during spaceflight.",31.824792019211863,3.4602456092834473,31.369237729142235,3.4458277225494385,32.04363201361372,3.4670984745025635,32.399499552252585,3.4781429767608643,30.5463512481598,3.4192452430725098,31.945709862470355,3.4640378952026367
a476b046f763b176931441e5bfe26b9a,gpt-5-mini,"Finally, the planned International Institute for Space Research and Technology will fund the creation of a new interdisciplinary team — comprising biologists, technologists, physicists and materials scientists — to conduct research on the ground and aboard space stations, providing new insights and approaches to the study of the various challenges facing humanity.",20.274682690597533,3.0093729496002197,20.34361930203958,3.0127673149108887,20.409675800117228,3.0160090923309326,21.17228235530566,3.0526928901672363,18.605724553085842,2.923469305038452,20.15404664222476,3.0034050941467285
674a8d4a2c5dc1cea829936907ccea7b,gpt-5-mini,"Research on branching morphologies in orbit strongly indicates that, in order to subject the fundamental theories of branching form and development to rigorous testing, long-duration, high-quality microgravity conditions are required.",60.07397762414706,4.095576763153076,61.414017743926394,4.117638111114502,61.28308016721026,4.115503787994385,60.54245880355771,4.103344917297363,63.12833607770712,4.145169734954834,59.60784252095322,4.08778715133667
b79bdb6266379ecd9111abea5d6c01ed,gpt-5-mini,"It is necessary to apply these theories to predict and realize the required microstructures in solidified materials, in order to tailor their many physical and chemical properties, such as mechanical strength and corrosion resistance.",38.57297452507365,3.6525518894195557,39.002722025082335,3.6636314392089844,38.94326326111324,3.6621057987213135,39.00514913269847,3.66369366645813,36.626705252097764,3.6007776260375977,38.487248061217045,3.65032696723938
6edb44080713388f27967e97076113ef,gpt-5-mini,"The MEPHISTO crystal furnace was developed by the French space agency and, under a cooperation agreement, is jointly used by researchers from the United States and France. It has a unique capability to study the formation of microstructures in solidifying materials, helping to elucidate how certain metals acquire their physical properties.",36.048795018264826,3.5848734378814697,36.586959087460215,3.599691867828369,36.557705087842685,3.5988919734954834,37.698338509245126,3.6296160221099854,33.8212584778763,3.521089553833008,36.75142491624823,3.6041769981384277
a909e8f2400df97c6dc5889e766fcf50,gpt-5-mini,The fact that 75 principal investigators from 13 countries deployed 82 payloads into orbit demonstrates that international exploration on the space station can enable highly efficient utilization of human spaceflight experiments.,82.22517318127503,4.409461498260498,83.7588069113217,4.42794132232666,82.15807644538465,4.408645153045654,83.6119192549087,4.4261860847473145,82.88702710382418,4.417478561401367,83.83980303270648,4.428907871246338
ca64e5232e17873f455bcebf0dc6e6b3,gpt-5-mini,"Under the memorandum of understanding signed between the Space Agency and the National Scientists Foundation, the two agencies will jointly study environmental signal transduction and plant cell differentiation in response to environmental stimuli, particularly gravity.",38.89570773381774,3.660883903503418,40.545981896869115,3.702436685562134,39.86919047367002,3.6856038570404053,40.66414812271407,3.7053468227386475,35.71006347029081,3.575432538986206,39.417206815289816,3.6742024421691895
a201db7e74069ac7ae7efad8b210a941,gpt-5-mini,"Integrated efforts in fiscal year 1994 also included structural load analysis; resolving in‑flight anomalies, automatic aborts and changes; and software development and testing of the mission control system for each flight.",137.39253195904476,4.922842025756836,130.86609107771363,4.87417459487915,128.3952028375928,4.8551130294799805,130.34296420591454,4.870169162750244,112.23542764521616,4.7205986976623535,136.92568893327046,4.919438362121582
74ce95ebc53f8843cedc92daf7fe083c,gpt-5-mini,"During the testing phase the satellite was positioned at 90°W, but the plan calls for it to be relocated to 75°W once it is placed into service. GOES‑7, launched seven years ago and still operational, will be moved from 112°W to 135°W so that the two satellites will provide contiguous coverage of the entire Western Hemisphere.",25.52921139344756,3.239823341369629,24.817795704820714,3.2115609645843506,24.19427944302117,3.1861162185668945,25.35510907909964,3.232980251312256,23.484376114521865,3.1563353538513184,25.695961449471405,3.2463338375091553
feee1bf05ddeaf2f74c4ccb0951ad737,gpt-5-mini,"The U.S. National Aeronautics and Space Administration (NASA) is responsible for launching and testing the GOES series satellites, and for overseeing their design, development and launch.",8.2325270687662,2.108093023300171,8.17054903546226,2.1005361080169678,8.171073067142379,2.100600242614746,8.11439473471545,2.093639612197876,7.659294706997587,2.0359199047088623,8.196901273265967,2.1037561893463135
603bcbc9941dabba261819adf9e0d0dc,gpt-5-mini,"The system uses a total of six NOAA environmental satellites and Russian navigation satellites, supported by a network of ground stations, to detect radio and beacon signals transmitted by persons in distress, and, via flight mission control centers such as the NOAA Flight Mission Control Center in Suitland, Maryland, relay those signals to rescue coordination centers.",44.56422937177356,3.796931505203247,43.70955252100105,3.77756667137146,43.894689995448935,3.7817933559417725,44.97251352936415,3.80605149269104,41.937155464612346,3.7361721992492676,44.29020810266911,3.7907636165618896
cf4cddb73a137107d2b940c826c7d01d,gpt-5-mini,"Thereafter, the end section of the tether re-entered the upper atmosphere and burned up, while the remaining 10–12-kilometre-long tether stayed attached to the rocket’s second stage and continued to orbit until 8 May 1994.",45.431166167982184,3.8161983489990234,36.50022448609163,3.597318410873413,39.50737825901854,3.676487445831299,43.42435298612496,3.7710204124450684,31.71316188925314,3.4567317962646484,44.65081100912297,3.798872470855713
4e42b8558b37c7c92d0c3691bc6d7373,gpt-5-mini,"In December 1993, the original twelve participating countries of the Freedom space station (the United States, Canada, Italy, Belgium, the Netherlands, Denmark, Norway, France, Spain, Germany, the United Kingdom and Japan) extended a formal invitation to Russia to join the cooperation, and Russia accepted.",18.47186123700239,2.9162485599517822,18.700129605943115,2.92853045463562,18.614616321743313,2.9239470958709717,18.47388720415521,2.916358232498169,15.889361472919132,2.7656497955322266,18.41160244079232,2.9129810333251953
6f0e3283436f5de9ede00115bb7bd125,gpt-5-mini,"In addition, Russia's cooperation has enhanced the capabilities of the International Space Station and further reduced costs for the United States, making the station an important element of the developing new relationship between the two countries.",17.86597121024467,2.8828978538513184,17.971660330105873,2.888796091079712,18.087394748164115,2.8952152729034424,17.876921684013887,2.8835105895996094,15.619015924963211,2.7484891414642334,17.491625629037557,2.861722230911255
2e3dcadc2ea68954aeceb74a78f4066e,gpt-5-mini,"At a technical exchange held in August 1994, NASA and the Russian Space Agency reached agreement on a range of important integration and operational matters, including how to send commands to and exercise control of the space station.",31.71797861646515,3.456883668899536,31.056723858373637,3.4358153343200684,31.08964689468549,3.4368748664855957,31.474734133369612,3.4491851329803467,28.37022704890796,3.3453402519226074,31.433818046660615,3.4478843212127686
ce2ac2d0abd3f638998ffbc9c707aa93,gpt-5-mini,"The European Space Agency was also developing the Ariane 5 launch vehicle and associated launch systems; by the end of fiscal year 1994, ESA was in discussions with NASA about the possible role these vehicles could play in the logistical resupply of the space station.",21.323157969141832,3.059793710708618,21.019156506977268,3.0454342365264893,20.829257207560648,3.036358594894409,20.552862801723336,3.0230002403259277,18.199630312142624,2.9014012813568115,21.069827183320083,3.047842025756836
f665a4c617afc0c0e94e9928a73eb502,gpt-5-mini,"Japan has been developing an experimental module comprising a multipurpose pressurized laboratory, a set of unpressurized external facilities, a remotely operated manipulator system, and several experimental logistics modules.",38.66323338583888,3.6548891067504883,40.24762334607493,3.6950509548187256,39.39018802281865,3.6735167503356934,40.45847487523688,3.7002761363983154,37.71914244316329,3.6301677227020264,38.90411967095691,3.661100149154663
f7a203949bc8de131f637ee3cf101f6a,gpt-5-mini,"The 3-meter-diameter liquid‑metal mirror telescope prototype currently in use at NASA’s Johnson Space Center is the 17th largest telescope in the world, and its manufacturing cost—about $500,000—is only 1% of that of comparable ground‑based astronomical telescopes.",33.710645664269556,3.5178136825561523,27.27564102715589,3.3059940338134766,28.22347088249195,3.340153932571411,32.71166346436601,3.487731695175171,22.7334622695307,3.123837947845459,34.462776477867756,3.53987979888916
efc65421446e7f03f2eb8660f57d4794,gpt-5-mini,"This new ground station, together with the existing facilities in Santa Paula, California, and Southbury, Connecticut, makes the U.S. communications‑satellite company the first to offer Inmarsat services as part of a global digital mobile satellite communications service.",37.04163043612018,3.6120424270629883,34.72781334077087,3.5475409030914307,34.127139743159645,3.53009295463562,35.4058354528909,3.5668766498565674,32.36089163566358,3.4769506454467773,36.47187460265861,3.596541404724121
63198db3fcf44963809e09cb9e046868,gpt-5-mini,"After the TDRS-1 satellite and the GRTS terminal system became operational, NASA's real-time data-recovery coverage expanded to encompass the Gamma-Ray Observatory's entire orbit. The Gamma-Ray Observatory is investigating the evolution of the universe, the properties of enigmatic astronomical objects, and the processes that produce extremely high-energy radiation.",30.704431886874378,3.4244070053100586,30.91031287069475,3.4310898780822754,30.855193301814534,3.429305076599121,31.612307545322345,3.4535465240478516,31.016114535765368,3.434506893157959,30.617864705065603,3.421583652496338
